{
  "schema_version": 2,
  "producer": {"name": "acta", "version": "v0.1.0", "commit": "0123456789abcdef", "date": "2026-08-19T10:00:00Z"},
  "id": "20260819T100000Z-codex-a1b2c3d4",
  "agent": "codex",
  "agent_version": "0.147.0",
  "cwd": "/workspace/example",
  "base_commit_sha": "1111111111111111111111111111111111111111",
  "base_branch": "main",
  "base_dirty": false,
  "head_commit_sha": "1111111111111111111111111111111111111111",
  "task_title": "Update the example",
  "run_dir": "/workspace/example/.acta/runs/20260819T100000Z-codex-a1b2c3d4",
  "command": ["codex", "exec", "--json", "--ephemeral", "--sandbox", "workspace-write", "--cd", "/workspace/example", "-"],
  "started_at": "2026-08-19T10:00:00Z",
  "completed_at": "2026-08-19T10:00:01Z",
  "duration_ms": 1000,
  "exit_code": 0,
  "ok": true,
  "timeout": false,
  "termination_reason": "completed",
  "raw_stdout_path": "/workspace/example/.acta/runs/20260819T100000Z-codex-a1b2c3d4/codex-events.jsonl",
  "raw_stderr_path": "/workspace/example/.acta/runs/20260819T100000Z-codex-a1b2c3d4/codex.stderr.log",
  "raw_stdout_artifact": "codex-events.jsonl",
  "raw_stderr_artifact": "codex.stderr.log",
  "prompt_source": "flag",
  "otlp_status": "not_configured",
  "raw_output_limit_bytes": 1073741824,
  "workspace_diff_limit_bytes": 268435456,
  "process_containment": "posix_process_group",
  "agent_config_mode": "ambient_ephemeral"
}
